{
  "schemaVersion": 1,
  "success": true,
  "version": "0.2.1-alpha",
  "source": "D:\\_2025\\Gits\\megaalive\\hlax64\\examples\\curriculum\\06-abi\\stack-alignment.hla64",
  "target": "linux-x64-sysv",
  "diagnostics": [],
  "ir": [
    "function _start:\n  entry:\n    v1 = Move v4\n    Call v1 [AddFive]\n    Call v5, v1, v6 [stdout.put]",
    "function AddFive:\n  entry:\n    v1 = Move v2\n    v1 = Add v3"
  ],
  "lowered": [
    "function _start:\n  entry: True, export: False\n  stack frame: 8 bytes\n  entry:\n        xor ebx, ebx    ; default exit code = 0 (callee-saved)\n        push rbp\n        mov rbp, rsp\n        sub rsp, 8      ; align stack to 16 bytes\n        mov rax, 10\n        mov rdi, rax\r\n    sub rsp, 8      ; align stack\r\n    call AddFive\r\n    add rsp, 8      ; restore stack\n        push rcx        ; preserve rcx (syscall clobbers it)\r\n    push rax      ; save for stdout.put\r\n    ; RUNTIME: stdout_put_str\r\n    mov rax, 1     ; sys_write\r\n    mov rdi, 1     ; stdout\r\n    lea rsi, [str_0]\r\n    mov rdx, 9\r\n    syscall\r\n    ; RUNTIME: stdout_put_int(rax)\r\n    pop rax         ; get saved register value\r\n    mov r8, 10\r\n    mov rdi, 0          ; digit count\r\n    jmp .Lchk_0\r\n.Ldiv_0:\r\n    xor rdx, rdx\r\n    div r8\r\n    push rdx             ; digit\r\n    inc rdi\r\n.Lchk_0:\r\n    test rax, rax\r\n    jnz .Ldiv_0\r\n    ; rdi = digit count, digits on stack\r\n    test rdi, rdi\r\n    jnz .Lbuf_0\r\n    push 0               ; zero digit\r\n    inc rdi\r\n.Lbuf_0:\r\n    mov rdx, rdi         ; byte count\r\n    sub rsp, rdx         ; stack buffer\r\n    mov r9, rdi          ; loop count\r\n    lea rsi, [rsp]       ; buffer ptr\r\n    lea rdi, [rsp\u002Brdx]   ; ptr to most significant digit\r\n.Lascii_0:\r\n    mov rax, [rdi]       ; read digit\r\n    add al, \u00270\u0027\r\n    mov [rsi], al\r\n    inc rsi\r\n    add rdi, 8           ; next digit\r\n    dec r9\r\n    jnz .Lascii_0\r\n    mov r8, rdx          ; save digit count\r\n    mov rax, 1           ; sys_write\r\n    mov rdi, 1           ; stdout\r\n    lea rsi, [rsp]       ; buffer\r\n    syscall\r\n    lea rsp, [rsp\u002Br8]    ; deallocate buffer\r\n    lea rsp, [rsp\u002Br8*8]  ; deallocate digit pushes\r\n    ; RUNTIME: stdout_put_nl\r\n    mov rax, 1     ; sys_write\r\n    mov rdi, 1     ; stdout\r\n    lea rsi, [newline]\r\n    mov rdx, 1\r\n    syscall\r\n    pop rcx         ; restore rcx\n        mov rdi, rbx    ; exit code\n        mov rax, 60     ; sys_exit\n        syscall",
    "function AddFive:\n  entry: False, export: False\n  stack frame: 16 bytes\n  parameters: x\n  entry:\n        push rbp\n        mov rbp, rsp\n        sub rsp, 16\n        mov qword [rbp-8], rdi\n        mov rax, qword [rbp-8]\n        add rax, 5\n        mov rsp, rbp\n        pop rbp\n        ret"
  ],
  "nasm": "bits 64\r\nsection .text\r\nglobal _start\r\n\r\n_start:\r\n    xor ebx, ebx    ; default exit code = 0 (callee-saved)\r\n    push rbp\r\n    mov rbp, rsp\r\n    sub rsp, 8      ; align stack to 16 bytes\r\n    mov rax, 10\r\n    mov rdi, rax\r\n    sub rsp, 8      ; align stack\r\n    call AddFive\r\n    add rsp, 8      ; restore stack\r\n    push rcx        ; preserve rcx (syscall clobbers it)\r\n    push rax      ; save for stdout.put\r\n    ; RUNTIME: stdout_put_str\r\n    mov rax, 1     ; sys_write\r\n    mov rdi, 1     ; stdout\r\n    lea rsi, [str_0]\r\n    mov rdx, 9\r\n    syscall\r\n    ; RUNTIME: stdout_put_int(rax)\r\n    pop rax         ; get saved register value\r\n    mov r8, 10\r\n    mov rdi, 0          ; digit count\r\n    jmp .Lchk_0\r\n    .Ldiv_0:\r\n    xor rdx, rdx\r\n    div r8\r\n    push rdx             ; digit\r\n    inc rdi\r\n    .Lchk_0:\r\n    test rax, rax\r\n    jnz .Ldiv_0\r\n    ; rdi = digit count, digits on stack\r\n    test rdi, rdi\r\n    jnz .Lbuf_0\r\n    push 0               ; zero digit\r\n    inc rdi\r\n    .Lbuf_0:\r\n    mov rdx, rdi         ; byte count\r\n    sub rsp, rdx         ; stack buffer\r\n    mov r9, rdi          ; loop count\r\n    lea rsi, [rsp]       ; buffer ptr\r\n    lea rdi, [rsp\u002Brdx]   ; ptr to most significant digit\r\n    .Lascii_0:\r\n    mov rax, [rdi]       ; read digit\r\n    add al, \u00270\u0027\r\n    mov [rsi], al\r\n    inc rsi\r\n    add rdi, 8           ; next digit\r\n    dec r9\r\n    jnz .Lascii_0\r\n    mov r8, rdx          ; save digit count\r\n    mov rax, 1           ; sys_write\r\n    mov rdi, 1           ; stdout\r\n    lea rsi, [rsp]       ; buffer\r\n    syscall\r\n    lea rsp, [rsp\u002Br8]    ; deallocate buffer\r\n    lea rsp, [rsp\u002Br8*8]  ; deallocate digit pushes\r\n    ; RUNTIME: stdout_put_nl\r\n    mov rax, 1     ; sys_write\r\n    mov rdi, 1     ; stdout\r\n    lea rsi, [newline]\r\n    mov rdx, 1\r\n    syscall\r\n    pop rcx         ; restore rcx\r\n    mov rdi, rbx    ; exit code\r\n    mov rax, 60     ; sys_exit\r\n    syscall\r\n\r\nAddFive:\r\n    push rbp\r\n    mov rbp, rsp\r\n    sub rsp, 16\r\n    mov qword [rbp-8], rdi\r\n    mov rax, qword [rbp-8]\r\n    add rax, 5\r\n    mov rsp, rbp\r\n    pop rbp\r\n    ret\r\n\r\nsection .data\r\nnewline db 0x0A\r\nstr_0 db \u002210 \u002B 5 = \u0022, 0\r\n"
}
