{
  "schemaVersion": 1,
  "success": true,
  "version": "0.2.1-alpha",
  "source": "D:\\_2025\\Gits\\megaalive\\hlax64\\examples\\project-euler\\problems\\euler009-pythagorean-triplet.hla64",
  "target": "linux-x64-sysv",
  "diagnostics": [],
  "ir": [
    "function _start:\n  entry:\n    v0 = Move v1\n    Branch  -\u003E while_header_0\n  while_header_0:\n    Compare (LessThanSigned) v0, v2\n    ConditionalBranch (GreaterOrEqualSigned)  -\u003E endwhile_0\n    Branch  -\u003E while_body_0\n  while_body_0:\n    v3 = Move v0\n    Branch  -\u003E while_header_1\n  while_header_1:\n    Compare (LessThanSigned) v3, v4\n    ConditionalBranch (GreaterOrEqualSigned)  -\u003E endwhile_1\n    Branch  -\u003E while_body_1\n  while_body_1:\n    v5 = Move v6\n    v7 = Move v0\n    v5 = Subtract v7\n    v7 = Move v3\n    v5 = Subtract v7\n    Compare (GreaterThanSigned) v5, v8\n    ConditionalBranch (GreaterThanSigned)  -\u003E then_2\n    Branch  -\u003E cont_2\n  then_2:\n    v9 = Move v0\n    v9 = Multiply v9\n    v7 = Move v3\n    v7 = Multiply v7\n    v9 = Add v7\n    v7 = Move v5\n    v7 = Multiply v7\n    Compare (Equal) v9, v7\n    ConditionalBranch (Equal)  -\u003E then_3\n    Branch  -\u003E cont_3\n  then_3:\n    v9 = Move v0\n    v9 = Multiply v3\n    v9 = Multiply v5\n    Call v10, v9, v11 [stdout.put]\n    v0 = Move v12\n    v3 = Move v13\n    Branch  -\u003E endif_3\n  endif_3:\n    Branch  -\u003E cont_3\n  cont_3:\n    Branch  -\u003E endif_2\n  endif_2:\n    Branch  -\u003E cont_2\n  cont_2:\n    v3 = Add v14\n    Branch  -\u003E while_header_1\n  endwhile_1:\n    Branch  -\u003E cont_1\n  cont_1:\n    v0 = Add v15\n    Branch  -\u003E while_header_0\n  endwhile_0:\n    Branch  -\u003E cont_0\n  cont_0:"
  ],
  "lowered": [
    "function _start:\n  entry: True, export: False\n  stack frame: 8 bytes\n  entry:\n        xor ebx, ebx    ; default exit code = 0 (callee-saved)\n        push rbp\n        mov rbp, rsp\n        sub rsp, 8      ; align stack to 16 bytes\n        mov r12, 1\n        jmp while_header_0\n  while_header_0:\n        cmp r12, 334\n        jge endwhile_0\n        jmp while_body_0\n  while_body_0:\n        mov r13, r12\n        jmp while_header_1\n  while_header_1:\n        cmp r13, 500\n        jge endwhile_1\n        jmp while_body_1\n  while_body_1:\n        mov r14, 1000\n        mov r11, r12\n        sub r14, r11\n        mov r11, r13\n        sub r14, r11\n        cmp r14, 0\n        jg then_2\n        jmp cont_2\n  then_2:\n        mov rax, r12\n        imul rax, rax\n        mov r11, r13\n        imul r11, r11\n        add rax, r11\n        mov r11, r14\n        imul r11, r11\n        cmp rax, r11\n        je then_3\n        jmp cont_3\n  then_3:\n        mov rax, r12\n        imul rax, r13\n        imul rax, r14\n        push rcx        ; preserve rcx (syscall clobbers it)\r\n    push rax      ; save for stdout.put\r\n    ; RUNTIME: stdout_put_str\r\n    mov rax, 1     ; sys_write\r\n    mov rdi, 1     ; stdout\r\n    lea rsi, [str_0]\r\n    mov rdx, 11\r\n    syscall\r\n    ; RUNTIME: stdout_put_int(rax)\r\n    pop rax         ; get saved register value\r\n    mov r8, 10\r\n    mov rdi, 0          ; digit count\r\n    jmp .Lchk_0\r\n.Ldiv_0:\r\n    xor rdx, rdx\r\n    div r8\r\n    push rdx             ; digit\r\n    inc rdi\r\n.Lchk_0:\r\n    test rax, rax\r\n    jnz .Ldiv_0\r\n    ; rdi = digit count, digits on stack\r\n    test rdi, rdi\r\n    jnz .Lbuf_0\r\n    push 0               ; zero digit\r\n    inc rdi\r\n.Lbuf_0:\r\n    mov rdx, rdi         ; byte count\r\n    sub rsp, rdx         ; stack buffer\r\n    mov r9, rdi          ; loop count\r\n    lea rsi, [rsp]       ; buffer ptr\r\n    lea rdi, [rsp\u002Brdx]   ; ptr to most significant digit\r\n.Lascii_0:\r\n    mov rax, [rdi]       ; read digit\r\n    add al, \u00270\u0027\r\n    mov [rsi], al\r\n    inc rsi\r\n    add rdi, 8           ; next digit\r\n    dec r9\r\n    jnz .Lascii_0\r\n    mov r8, rdx          ; save digit count\r\n    mov rax, 1           ; sys_write\r\n    mov rdi, 1           ; stdout\r\n    lea rsi, [rsp]       ; buffer\r\n    syscall\r\n    lea rsp, [rsp\u002Br8]    ; deallocate buffer\r\n    lea rsp, [rsp\u002Br8*8]  ; deallocate digit pushes\r\n    ; RUNTIME: stdout_put_nl\r\n    mov rax, 1     ; sys_write\r\n    mov rdi, 1     ; stdout\r\n    lea rsi, [newline]\r\n    mov rdx, 1\r\n    syscall\r\n    pop rcx         ; restore rcx\n        mov r12, 1000\n        mov r13, 1000\n        jmp endif_3\n  endif_3:\n        jmp cont_3\n  cont_3:\n        jmp endif_2\n  endif_2:\n        jmp cont_2\n  cont_2:\n        add r13, 1\n        jmp while_header_1\n  endwhile_1:\n        jmp cont_1\n  cont_1:\n        add r12, 1\n        jmp while_header_0\n  endwhile_0:\n        jmp cont_0\n  cont_0:\n        mov rdi, rbx    ; exit code\n        mov rax, 60     ; sys_exit\n        syscall"
  ],
  "nasm": "bits 64\r\nsection .text\r\nglobal _start\r\n\r\n_start:\r\n    xor ebx, ebx    ; default exit code = 0 (callee-saved)\r\n    push rbp\r\n    mov rbp, rsp\r\n    sub rsp, 8      ; align stack to 16 bytes\r\n    mov r12, 1\r\n    jmp while_header_0\r\nwhile_header_0:\r\n    cmp r12, 334\r\n    jge endwhile_0\r\n    jmp while_body_0\r\nwhile_body_0:\r\n    mov r13, r12\r\n    jmp while_header_1\r\nwhile_header_1:\r\n    cmp r13, 500\r\n    jge endwhile_1\r\n    jmp while_body_1\r\nwhile_body_1:\r\n    mov r14, 1000\r\n    mov r11, r12\r\n    sub r14, r11\r\n    mov r11, r13\r\n    sub r14, r11\r\n    cmp r14, 0\r\n    jg then_2\r\n    jmp cont_2\r\nthen_2:\r\n    mov rax, r12\r\n    imul rax, rax\r\n    mov r11, r13\r\n    imul r11, r11\r\n    add rax, r11\r\n    mov r11, r14\r\n    imul r11, r11\r\n    cmp rax, r11\r\n    je then_3\r\n    jmp cont_3\r\nthen_3:\r\n    mov rax, r12\r\n    imul rax, r13\r\n    imul rax, r14\r\n    push rcx        ; preserve rcx (syscall clobbers it)\r\n    push rax      ; save for stdout.put\r\n    ; RUNTIME: stdout_put_str\r\n    mov rax, 1     ; sys_write\r\n    mov rdi, 1     ; stdout\r\n    lea rsi, [str_0]\r\n    mov rdx, 11\r\n    syscall\r\n    ; RUNTIME: stdout_put_int(rax)\r\n    pop rax         ; get saved register value\r\n    mov r8, 10\r\n    mov rdi, 0          ; digit count\r\n    jmp .Lchk_0\r\n    .Ldiv_0:\r\n    xor rdx, rdx\r\n    div r8\r\n    push rdx             ; digit\r\n    inc rdi\r\n    .Lchk_0:\r\n    test rax, rax\r\n    jnz .Ldiv_0\r\n    ; rdi = digit count, digits on stack\r\n    test rdi, rdi\r\n    jnz .Lbuf_0\r\n    push 0               ; zero digit\r\n    inc rdi\r\n    .Lbuf_0:\r\n    mov rdx, rdi         ; byte count\r\n    sub rsp, rdx         ; stack buffer\r\n    mov r9, rdi          ; loop count\r\n    lea rsi, [rsp]       ; buffer ptr\r\n    lea rdi, [rsp\u002Brdx]   ; ptr to most significant digit\r\n    .Lascii_0:\r\n    mov rax, [rdi]       ; read digit\r\n    add al, \u00270\u0027\r\n    mov [rsi], al\r\n    inc rsi\r\n    add rdi, 8           ; next digit\r\n    dec r9\r\n    jnz .Lascii_0\r\n    mov r8, rdx          ; save digit count\r\n    mov rax, 1           ; sys_write\r\n    mov rdi, 1           ; stdout\r\n    lea rsi, [rsp]       ; buffer\r\n    syscall\r\n    lea rsp, [rsp\u002Br8]    ; deallocate buffer\r\n    lea rsp, [rsp\u002Br8*8]  ; deallocate digit pushes\r\n    ; RUNTIME: stdout_put_nl\r\n    mov rax, 1     ; sys_write\r\n    mov rdi, 1     ; stdout\r\n    lea rsi, [newline]\r\n    mov rdx, 1\r\n    syscall\r\n    pop rcx         ; restore rcx\r\n    mov r12, 1000\r\n    mov r13, 1000\r\n    jmp endif_3\r\nendif_3:\r\n    jmp cont_3\r\ncont_3:\r\n    jmp endif_2\r\nendif_2:\r\n    jmp cont_2\r\ncont_2:\r\n    add r13, 1\r\n    jmp while_header_1\r\nendwhile_1:\r\n    jmp cont_1\r\ncont_1:\r\n    add r12, 1\r\n    jmp while_header_0\r\nendwhile_0:\r\n    jmp cont_0\r\ncont_0:\r\n    mov rdi, rbx    ; exit code\r\n    mov rax, 60     ; sys_exit\r\n    syscall\r\n\r\nsection .data\r\nnewline db 0x0A\r\nstr_0 db \u0022Euler #9 = \u0022, 0\r\n"
}
