{
  "schemaVersion": 1,
  "success": true,
  "version": "0.2.1-alpha",
  "source": "D:\\_2025\\Gits\\megaalive\\hlax64\\examples\\project-euler\\problems\\euler041-template.hla64",
  "target": "linux-x64-sysv",
  "diagnostics": [],
  "ir": [
    "function _start:\n  entry:\n    Call v0, v1 [stdout.put]"
  ],
  "lowered": [
    "function _start:\n  entry: True, export: False\n  stack frame: 8 bytes\n  entry:\n        xor ebx, ebx    ; default exit code = 0 (callee-saved)\n        push rbp\n        mov rbp, rsp\n        sub rsp, 8      ; align stack to 16 bytes\n        push rcx        ; preserve rcx (syscall clobbers it)\r\n    ; RUNTIME: stdout_put_str\r\n    mov rax, 1     ; sys_write\r\n    mov rdi, 1     ; stdout\r\n    lea rsi, [str_0]\r\n    mov rdx, 64\r\n    syscall\r\n    ; RUNTIME: stdout_put_nl\r\n    mov rax, 1     ; sys_write\r\n    mov rdi, 1     ; stdout\r\n    lea rsi, [newline]\r\n    mov rdx, 1\r\n    syscall\r\n    pop rcx         ; restore rcx\n        mov rdi, rbx    ; exit code\n        mov rax, 60     ; sys_exit\n        syscall"
  ],
  "nasm": "bits 64\r\nsection .text\r\nglobal _start\r\n\r\n_start:\r\n    xor ebx, ebx    ; default exit code = 0 (callee-saved)\r\n    push rbp\r\n    mov rbp, rsp\r\n    sub rsp, 8      ; align stack to 16 bytes\r\n    push rcx        ; preserve rcx (syscall clobbers it)\r\n    ; RUNTIME: stdout_put_str\r\n    mov rax, 1     ; sys_write\r\n    mov rdi, 1     ; stdout\r\n    lea rsi, [str_0]\r\n    mov rdx, 64\r\n    syscall\r\n    ; RUNTIME: stdout_put_nl\r\n    mov rax, 1     ; sys_write\r\n    mov rdi, 1     ; stdout\r\n    lea rsi, [newline]\r\n    mov rdx, 1\r\n    syscall\r\n    pop rcx         ; restore rcx\r\n    mov rdi, rbx    ; exit code\r\n    mov rax, 60     ; sys_exit\r\n    syscall\r\n\r\nsection .data\r\nnewline db 0x0A\r\nstr_0 db \u0022Euler #41 template \u2014 implement after solving on projecteuler.net\u0022, 0\r\n"
}
