{
  "schemaVersion": 1,
  "success": true,
  "version": "0.2.1-alpha",
  "source": "D:\\_2025\\Gits\\megaalive\\hlax64\\examples\\qa\\bug-farm\\deep-nested-if\\deep-nested-if.hla64",
  "target": "linux-x64-sysv",
  "diagnostics": [],
  "ir": [
    "function _start:\n  entry:\n    Call v18 [Classify]\n    v19 = Move v3",
    "function Classify:\n  entry:\n    v1 = Move v2\n    v3 = Move v4\n    Compare (Equal) v1, v5\n    ConditionalBranch (Equal)  -\u003E then_0\n    Branch  -\u003E else_0\n  then_0:\n    v3 = Move v6\n    Branch  -\u003E endif_0\n  else_0:\n    Compare (Equal) v1, v7\n    ConditionalBranch (Equal)  -\u003E then_1\n    Branch  -\u003E else_1\n  then_1:\n    v3 = Move v8\n    Branch  -\u003E endif_1\n  else_1:\n    Compare (Equal) v1, v9\n    ConditionalBranch (Equal)  -\u003E then_2\n    Branch  -\u003E else_2\n  then_2:\n    v3 = Move v10\n    Branch  -\u003E endif_2\n  else_2:\n    Compare (Equal) v1, v11\n    ConditionalBranch (Equal)  -\u003E then_3\n    Branch  -\u003E else_3\n  then_3:\n    v3 = Move v12\n    Branch  -\u003E endif_3\n  else_3:\n    Compare (Equal) v1, v13\n    ConditionalBranch (Equal)  -\u003E then_4\n    Branch  -\u003E else_4\n  then_4:\n    v3 = Move v14\n    Branch  -\u003E endif_4\n  else_4:\n    Compare (Equal) v1, v15\n    ConditionalBranch (Equal)  -\u003E then_5\n    Branch  -\u003E else_5\n  then_5:\n    v3 = Move v16\n    Branch  -\u003E endif_5\n  else_5:\n    v3 = Move v17\n    Branch  -\u003E endif_5\n  endif_5:\n    Branch  -\u003E cont_5\n  cont_5:\n    Branch  -\u003E endif_4\n  endif_4:\n    Branch  -\u003E cont_4\n  cont_4:\n    Branch  -\u003E endif_3\n  endif_3:\n    Branch  -\u003E cont_3\n  cont_3:\n    Branch  -\u003E endif_2\n  endif_2:\n    Branch  -\u003E cont_2\n  cont_2:\n    Branch  -\u003E endif_1\n  endif_1:\n    Branch  -\u003E cont_1\n  cont_1:\n    Branch  -\u003E endif_0\n  endif_0:\n    Branch  -\u003E cont_0\n  cont_0:"
  ],
  "lowered": [
    "function _start:\n  entry: True, export: False\n  stack frame: 8 bytes\n  entry:\n        xor ebx, ebx    ; default exit code = 0 (callee-saved)\n        push rbp\n        mov rbp, rsp\n        sub rsp, 8      ; align stack to 16 bytes\n        mov rdi, 3\r\n    sub rsp, 8      ; align stack\r\n    call Classify\r\n    add rsp, 8      ; restore stack\n        mov rbx, rax\n        mov rdi, rbx    ; exit code\n        mov rax, 60     ; sys_exit\n        syscall",
    "function Classify:\n  entry: False, export: False\n  stack frame: 16 bytes\n  parameters: n\n  entry:\n        push rbp\n        mov rbp, rsp\n        sub rsp, 16\n        mov qword [rbp-8], rdi\n        mov r8, qword [rbp-8]\n        mov rax, 0\n        cmp r8, 0\n        je then_0\n        jmp else_0\n  then_0:\n        mov rax, 1\n        jmp endif_0\n  else_0:\n        cmp r8, 1\n        je then_1\n        jmp else_1\n  then_1:\n        mov rax, 2\n        jmp endif_1\n  else_1:\n        cmp r8, 2\n        je then_2\n        jmp else_2\n  then_2:\n        mov rax, 3\n        jmp endif_2\n  else_2:\n        cmp r8, 3\n        je then_3\n        jmp else_3\n  then_3:\n        mov rax, 4\n        jmp endif_3\n  else_3:\n        cmp r8, 4\n        je then_4\n        jmp else_4\n  then_4:\n        mov rax, 5\n        jmp endif_4\n  else_4:\n        cmp r8, 5\n        je then_5\n        jmp else_5\n  then_5:\n        mov rax, 6\n        jmp endif_5\n  else_5:\n        mov rax, 99\n        jmp endif_5\n  endif_5:\n        jmp cont_5\n  cont_5:\n        jmp endif_4\n  endif_4:\n        jmp cont_4\n  cont_4:\n        jmp endif_3\n  endif_3:\n        jmp cont_3\n  cont_3:\n        jmp endif_2\n  endif_2:\n        jmp cont_2\n  cont_2:\n        jmp endif_1\n  endif_1:\n        jmp cont_1\n  cont_1:\n        jmp endif_0\n  endif_0:\n        jmp cont_0\n  cont_0:\n        mov rsp, rbp\n        pop rbp\n        ret"
  ],
  "nasm": "bits 64\r\ndefault rel\r\nsection .text\r\nglobal _start\r\n\r\n_start:\r\n    xor ebx, ebx    ; default exit code = 0 (callee-saved)\r\n    push rbp\r\n    mov rbp, rsp\r\n    sub rsp, 8      ; align stack to 16 bytes\r\n    mov rdi, 3\r\n    sub rsp, 8      ; align stack\r\n    call Classify\r\n    add rsp, 8      ; restore stack\r\n    mov rbx, rax\r\n    mov rdi, rbx    ; exit code\r\n    mov rax, 60     ; sys_exit\r\n    syscall\r\n\r\nClassify:\r\n    push rbp\r\n    mov rbp, rsp\r\n    sub rsp, 16\r\n    mov qword [rbp-8], rdi\r\n    mov r8, qword [rbp-8]\r\n    mov rax, 0\r\n    cmp r8, 0\r\n    je then_0\r\n    jmp else_0\r\nthen_0:\r\n    mov rax, 1\r\n    jmp endif_0\r\nelse_0:\r\n    cmp r8, 1\r\n    je then_1\r\n    jmp else_1\r\nthen_1:\r\n    mov rax, 2\r\n    jmp endif_1\r\nelse_1:\r\n    cmp r8, 2\r\n    je then_2\r\n    jmp else_2\r\nthen_2:\r\n    mov rax, 3\r\n    jmp endif_2\r\nelse_2:\r\n    cmp r8, 3\r\n    je then_3\r\n    jmp else_3\r\nthen_3:\r\n    mov rax, 4\r\n    jmp endif_3\r\nelse_3:\r\n    cmp r8, 4\r\n    je then_4\r\n    jmp else_4\r\nthen_4:\r\n    mov rax, 5\r\n    jmp endif_4\r\nelse_4:\r\n    cmp r8, 5\r\n    je then_5\r\n    jmp else_5\r\nthen_5:\r\n    mov rax, 6\r\n    jmp endif_5\r\nelse_5:\r\n    mov rax, 99\r\n    jmp endif_5\r\nendif_5:\r\n    jmp cont_5\r\ncont_5:\r\n    jmp endif_4\r\nendif_4:\r\n    jmp cont_4\r\ncont_4:\r\n    jmp endif_3\r\nendif_3:\r\n    jmp cont_3\r\ncont_3:\r\n    jmp endif_2\r\nendif_2:\r\n    jmp cont_2\r\ncont_2:\r\n    jmp endif_1\r\nendif_1:\r\n    jmp cont_1\r\ncont_1:\r\n    jmp endif_0\r\nendif_0:\r\n    jmp cont_0\r\ncont_0:\r\n    mov rsp, rbp\r\n    pop rbp\r\n    ret\r\n\r\nsection .data\r\nnewline db 0x0A\r\n"
}
