{
  "schemaVersion": 1,
  "success": true,
  "version": "0.2.1-alpha",
  "source": "D:\\_2025\\Gits\\megaalive\\hlax64\\examples\\curriculum\\06-abi\\stack-args-sysv.hla64",
  "target": "linux-x64-sysv",
  "diagnostics": [],
  "ir": [
    "function _start:\n  entry:\n    Call v17, v18, v19, v20, v21, v22, v23, v24 [Sum8]\n    Call v25, v8, v26 [stdout.put]",
    "function Sum8:\n  entry:\n    v8 = Move v9\n    v8 = Add v10\n    v8 = Add v11\n    v8 = Add v12\n    v8 = Add v13\n    v8 = Add v14\n    v8 = Add v15\n    v8 = Add v16"
  ],
  "lowered": [
    "function _start:\n  entry: True, export: False\n  stack frame: 8 bytes\n  entry:\n        xor ebx, ebx    ; default exit code = 0 (callee-saved)\n        push rbp\n        mov rbp, rsp\n        sub rsp, 8      ; align stack to 16 bytes\n        push 8      ; stack arg\r\n    push 7      ; stack arg\r\n    mov rdi, 1\r\n    mov rsi, 2\r\n    mov rdx, 3\r\n    mov rcx, 4\r\n    mov r8, 5\r\n    mov r9, 6\r\n    call Sum8\r\n    add rsp, 16      ; restore stack\n        push rcx        ; preserve rcx (syscall clobbers it)\r\n    push rax      ; save for stdout.put\r\n    ; RUNTIME: stdout_put_str\r\n    mov rax, 1     ; sys_write\r\n    mov rdi, 1     ; stdout\r\n    lea rsi, [str_0]\r\n    mov rdx, 18\r\n    syscall\r\n    ; RUNTIME: stdout_put_int(rax)\r\n    pop rax         ; get saved register value\r\n    mov r8, 10\r\n    mov rdi, 0          ; digit count\r\n    jmp .Lchk_0\r\n.Ldiv_0:\r\n    xor rdx, rdx\r\n    div r8\r\n    push rdx             ; digit\r\n    inc rdi\r\n.Lchk_0:\r\n    test rax, rax\r\n    jnz .Ldiv_0\r\n    ; rdi = digit count, digits on stack\r\n    test rdi, rdi\r\n    jnz .Lbuf_0\r\n    push 0               ; zero digit\r\n    inc rdi\r\n.Lbuf_0:\r\n    mov rdx, rdi         ; byte count\r\n    sub rsp, rdx         ; stack buffer\r\n    mov r9, rdi          ; loop count\r\n    lea rsi, [rsp]       ; buffer ptr\r\n    lea rdi, [rsp\u002Brdx]   ; ptr to most significant digit\r\n.Lascii_0:\r\n    mov rax, [rdi]       ; read digit\r\n    add al, \u00270\u0027\r\n    mov [rsi], al\r\n    inc rsi\r\n    add rdi, 8           ; next digit\r\n    dec r9\r\n    jnz .Lascii_0\r\n    mov r8, rdx          ; save digit count\r\n    mov rax, 1           ; sys_write\r\n    mov rdi, 1           ; stdout\r\n    lea rsi, [rsp]       ; buffer\r\n    syscall\r\n    lea rsp, [rsp\u002Br8]    ; deallocate buffer\r\n    lea rsp, [rsp\u002Br8*8]  ; deallocate digit pushes\r\n    ; RUNTIME: stdout_put_nl\r\n    mov rax, 1     ; sys_write\r\n    mov rdi, 1     ; stdout\r\n    lea rsi, [newline]\r\n    mov rdx, 1\r\n    syscall\r\n    pop rcx         ; restore rcx\n        mov rdi, rbx    ; exit code\n        mov rax, 60     ; sys_exit\n        syscall",
    "function Sum8:\n  entry: False, export: False\n  stack frame: 64 bytes\n  parameters: a, b, c, d, e, f, g, h\n  entry:\n        push rbp\n        mov rbp, rsp\n        sub rsp, 64\n        mov qword [rbp-8], rdi\n        mov qword [rbp-16], rsi\n        mov qword [rbp-24], rdx\n        mov qword [rbp-32], rcx\n        mov qword [rbp-40], r8\n        mov qword [rbp-48], r9\n        mov rax, qword [rbp\u002B16]\n    mov qword [rbp-56], rax\n        mov rax, qword [rbp\u002B24]\n    mov qword [rbp-64], rax\n        mov rax, qword [rbp-8]\n        add rax, qword [rbp-16]\n        add rax, qword [rbp-24]\n        add rax, qword [rbp-32]\n        add rax, qword [rbp-40]\n        add rax, qword [rbp-48]\n        add rax, qword [rbp-56]\n        add rax, qword [rbp-64]\n        mov rsp, rbp\n        pop rbp\n        ret"
  ],
  "nasm": "bits 64\r\nsection .text\r\nglobal _start\r\n\r\n_start:\r\n    xor ebx, ebx    ; default exit code = 0 (callee-saved)\r\n    push rbp\r\n    mov rbp, rsp\r\n    sub rsp, 8      ; align stack to 16 bytes\r\n    push 8      ; stack arg\r\n    push 7      ; stack arg\r\n    mov rdi, 1\r\n    mov rsi, 2\r\n    mov rdx, 3\r\n    mov rcx, 4\r\n    mov r8, 5\r\n    mov r9, 6\r\n    call Sum8\r\n    add rsp, 16      ; restore stack\r\n    push rcx        ; preserve rcx (syscall clobbers it)\r\n    push rax      ; save for stdout.put\r\n    ; RUNTIME: stdout_put_str\r\n    mov rax, 1     ; sys_write\r\n    mov rdi, 1     ; stdout\r\n    lea rsi, [str_0]\r\n    mov rdx, 18\r\n    syscall\r\n    ; RUNTIME: stdout_put_int(rax)\r\n    pop rax         ; get saved register value\r\n    mov r8, 10\r\n    mov rdi, 0          ; digit count\r\n    jmp .Lchk_0\r\n    .Ldiv_0:\r\n    xor rdx, rdx\r\n    div r8\r\n    push rdx             ; digit\r\n    inc rdi\r\n    .Lchk_0:\r\n    test rax, rax\r\n    jnz .Ldiv_0\r\n    ; rdi = digit count, digits on stack\r\n    test rdi, rdi\r\n    jnz .Lbuf_0\r\n    push 0               ; zero digit\r\n    inc rdi\r\n    .Lbuf_0:\r\n    mov rdx, rdi         ; byte count\r\n    sub rsp, rdx         ; stack buffer\r\n    mov r9, rdi          ; loop count\r\n    lea rsi, [rsp]       ; buffer ptr\r\n    lea rdi, [rsp\u002Brdx]   ; ptr to most significant digit\r\n    .Lascii_0:\r\n    mov rax, [rdi]       ; read digit\r\n    add al, \u00270\u0027\r\n    mov [rsi], al\r\n    inc rsi\r\n    add rdi, 8           ; next digit\r\n    dec r9\r\n    jnz .Lascii_0\r\n    mov r8, rdx          ; save digit count\r\n    mov rax, 1           ; sys_write\r\n    mov rdi, 1           ; stdout\r\n    lea rsi, [rsp]       ; buffer\r\n    syscall\r\n    lea rsp, [rsp\u002Br8]    ; deallocate buffer\r\n    lea rsp, [rsp\u002Br8*8]  ; deallocate digit pushes\r\n    ; RUNTIME: stdout_put_nl\r\n    mov rax, 1     ; sys_write\r\n    mov rdi, 1     ; stdout\r\n    lea rsi, [newline]\r\n    mov rdx, 1\r\n    syscall\r\n    pop rcx         ; restore rcx\r\n    mov rdi, rbx    ; exit code\r\n    mov rax, 60     ; sys_exit\r\n    syscall\r\n\r\nSum8:\r\n    push rbp\r\n    mov rbp, rsp\r\n    sub rsp, 64\r\n    mov qword [rbp-8], rdi\r\n    mov qword [rbp-16], rsi\r\n    mov qword [rbp-24], rdx\r\n    mov qword [rbp-32], rcx\r\n    mov qword [rbp-40], r8\r\n    mov qword [rbp-48], r9\r\n    mov rax, qword [rbp\u002B16]\r\n    mov qword [rbp-56], rax\r\n    mov rax, qword [rbp\u002B24]\r\n    mov qword [rbp-64], rax\r\n    mov rax, qword [rbp-8]\r\n    add rax, qword [rbp-16]\r\n    add rax, qword [rbp-24]\r\n    add rax, qword [rbp-32]\r\n    add rax, qword [rbp-40]\r\n    add rax, qword [rbp-48]\r\n    add rax, qword [rbp-56]\r\n    add rax, qword [rbp-64]\r\n    mov rsp, rbp\r\n    pop rbp\r\n    ret\r\n\r\nsection .data\r\nnewline db 0x0A\r\nstr_0 db \u00221\u002B2\u002B3\u002B4\u002B5\u002B6\u002B7\u002B8 = \u0022, 0\r\n"
}
