{
  "schemaVersion": 1,
  "success": true,
  "version": "0.1.0-alpha",
  "source": "D:\\_2025\\Gits\\megaalive\\hlax64\\examples\\20-project-euler\\problems\\euler001-multiples-of-3-and-5-bruteforce.hla64",
  "target": "linux-x64-sysv",
  "diagnostics": [],
  "ir": [
    "function _start:\n  entry:\n    v0 = Move v1\n    v2 = Move v3\n    v4 = Move v5\n    Branch  -\u003E while_header_0\n  while_header_0:\n    Compare (LessThanSigned) v6, v4\n    ConditionalBranch (GreaterOrEqualSigned)  -\u003E endwhile_0\n    Branch  -\u003E while_body_0\n  while_body_0:\n    v7 = Move v8\n    v9 = Move v10\n    v7 = Modulo v9\n    Compare (Equal) v7, v11\n    ConditionalBranch (Equal)  -\u003E then_1\n    Branch  -\u003E else_1\n  then_1:\n    v12 = Move v13\n    v14 = Add v12\n    Branch  -\u003E endif_1\n  else_1:\n    v7 = Move v15\n    v9 = Move v16\n    v7 = Modulo v9\n    Compare (Equal) v7, v17\n    ConditionalBranch (Equal)  -\u003E then_2\n    Branch  -\u003E cont_2\n  then_2:\n    v12 = Move v18\n    v19 = Add v12\n    Branch  -\u003E endif_2\n  endif_2:\n    Branch  -\u003E cont_2\n  cont_2:\n    Branch  -\u003E endif_1\n  endif_1:\n    Branch  -\u003E cont_1\n  cont_1:\n    v20 = Add v21\n    Branch  -\u003E while_header_0\n  endwhile_0:\n    Branch  -\u003E cont_0\n  cont_0:\n    v22 = Move v23\n    Call v24, v22, v25 [stdout.put]"
  ],
  "lowered": [
    "function _start:\n  entry: True, export: False\n  stack frame: 8 bytes\n  entry:\n        xor ebx, ebx    ; default exit code = 0 (callee-saved)\n        push rbp\n        mov rbp, rsp\n        sub rsp, 8      ; align stack to 16 bytes\n        mov [i], 0\n        mov [total], 0\n        mov rbx, 1000\n        jmp while_header_0\n  while_header_0:\n        cmp [i], rbx\n        jge endwhile_0\n        jmp while_body_0\n  while_body_0:\n        mov rax, [i]\n        mov r10, 3\n        cqo\r\n    idiv r10\r\n    mov rax, rdx\n        cmp rax, 0\n        je then_1\n        jmp else_1\n  then_1:\n        mov r11, [i]\n        add [total], r11\n        jmp endif_1\n  else_1:\n        mov rax, [i]\n        mov r10, 5\n        cqo\r\n    idiv r10\r\n    mov rax, rdx\n        cmp rax, 0\n        je then_2\n        jmp cont_2\n  then_2:\n        mov r11, [i]\n        add [total], r11\n        jmp endif_2\n  endif_2:\n        jmp cont_2\n  cont_2:\n        jmp endif_1\n  endif_1:\n        jmp cont_1\n  cont_1:\n        add [i], 1\n        jmp while_header_0\n  endwhile_0:\n        jmp cont_0\n  cont_0:\n        mov rdx, [total]\n        push rcx        ; preserve rcx (syscall clobbers it)\r\n    push rdx      ; save for stdout.put\r\n    ; RUNTIME: stdout_put_str\r\n    mov rax, 1     ; sys_write\r\n    mov rdi, 1     ; stdout\r\n    lea rsi, [str_0]\r\n    mov rdx, 11\r\n    syscall\r\n    ; RUNTIME: stdout_put_int(rdx)\r\n    pop rax         ; get saved register value\r\n    mov r8, 10\r\n    mov rdi, 0          ; digit count\r\n    jmp .Lchk_0\r\n.Ldiv_0:\r\n    xor rdx, rdx\r\n    div r8\r\n    push rdx             ; digit\r\n    inc rdi\r\n.Lchk_0:\r\n    test rax, rax\r\n    jnz .Ldiv_0\r\n    ; rdi = digit count, digits on stack\r\n    test rdi, rdi\r\n    jnz .Lbuf_0\r\n    push 0               ; zero digit\r\n    inc rdi\r\n.Lbuf_0:\r\n    mov rdx, rdi         ; byte count\r\n    sub rsp, rdx         ; stack buffer\r\n    mov r9, rdi          ; loop count\r\n    lea rsi, [rsp]       ; buffer ptr\r\n    lea rdi, [rsp\u002Brdx]   ; ptr to most significant digit\r\n.Lascii_0:\r\n    mov rax, [rdi]       ; read digit\r\n    add al, \u00270\u0027\r\n    mov [rsi], al\r\n    inc rsi\r\n    add rdi, 8           ; next digit\r\n    dec r9\r\n    jnz .Lascii_0\r\n    mov r8, rdx          ; save digit count\r\n    mov rax, 1           ; sys_write\r\n    mov rdi, 1           ; stdout\r\n    lea rsi, [rsp]       ; buffer\r\n    syscall\r\n    lea rsp, [rsp\u002Br8]    ; deallocate buffer\r\n    lea rsp, [rsp\u002Br8*8]  ; deallocate digit pushes\r\n    ; RUNTIME: stdout_put_nl\r\n    mov rax, 1     ; sys_write\r\n    mov rdi, 1     ; stdout\r\n    lea rsi, [newline]\r\n    mov rdx, 1\r\n    syscall\r\n    pop rcx         ; restore rcx\n        mov rdi, rbx    ; exit code\n        mov rax, 60     ; sys_exit\n        syscall"
  ],
  "nasm": "bits 64\r\nsection .text\r\nglobal _start\r\n\r\n_start:\r\n    xor ebx, ebx    ; default exit code = 0 (callee-saved)\r\n    push rbp\r\n    mov rbp, rsp\r\n    sub rsp, 8      ; align stack to 16 bytes\r\n    mov [i], 0\r\n    mov [total], 0\r\n    mov rbx, 1000\r\n    jmp while_header_0\r\nwhile_header_0:\r\n    cmp [i], rbx\r\n    jge endwhile_0\r\n    jmp while_body_0\r\nwhile_body_0:\r\n    mov rax, [i]\r\n    mov r10, 3\r\n    cqo\r\n    idiv r10\r\n    mov rax, rdx\r\n    cmp rax, 0\r\n    je then_1\r\n    jmp else_1\r\nthen_1:\r\n    mov r11, [i]\r\n    add [total], r11\r\n    jmp endif_1\r\nelse_1:\r\n    mov rax, [i]\r\n    mov r10, 5\r\n    cqo\r\n    idiv r10\r\n    mov rax, rdx\r\n    cmp rax, 0\r\n    je then_2\r\n    jmp cont_2\r\nthen_2:\r\n    mov r11, [i]\r\n    add [total], r11\r\n    jmp endif_2\r\nendif_2:\r\n    jmp cont_2\r\ncont_2:\r\n    jmp endif_1\r\nendif_1:\r\n    jmp cont_1\r\ncont_1:\r\n    add [i], 1\r\n    jmp while_header_0\r\nendwhile_0:\r\n    jmp cont_0\r\ncont_0:\r\n    mov rdx, [total]\r\n    push rcx        ; preserve rcx (syscall clobbers it)\r\n    push rdx      ; save for stdout.put\r\n    ; RUNTIME: stdout_put_str\r\n    mov rax, 1     ; sys_write\r\n    mov rdi, 1     ; stdout\r\n    lea rsi, [str_0]\r\n    mov rdx, 11\r\n    syscall\r\n    ; RUNTIME: stdout_put_int(rdx)\r\n    pop rax         ; get saved register value\r\n    mov r8, 10\r\n    mov rdi, 0          ; digit count\r\n    jmp .Lchk_0\r\n    .Ldiv_0:\r\n    xor rdx, rdx\r\n    div r8\r\n    push rdx             ; digit\r\n    inc rdi\r\n    .Lchk_0:\r\n    test rax, rax\r\n    jnz .Ldiv_0\r\n    ; rdi = digit count, digits on stack\r\n    test rdi, rdi\r\n    jnz .Lbuf_0\r\n    push 0               ; zero digit\r\n    inc rdi\r\n    .Lbuf_0:\r\n    mov rdx, rdi         ; byte count\r\n    sub rsp, rdx         ; stack buffer\r\n    mov r9, rdi          ; loop count\r\n    lea rsi, [rsp]       ; buffer ptr\r\n    lea rdi, [rsp\u002Brdx]   ; ptr to most significant digit\r\n    .Lascii_0:\r\n    mov rax, [rdi]       ; read digit\r\n    add al, \u00270\u0027\r\n    mov [rsi], al\r\n    inc rsi\r\n    add rdi, 8           ; next digit\r\n    dec r9\r\n    jnz .Lascii_0\r\n    mov r8, rdx          ; save digit count\r\n    mov rax, 1           ; sys_write\r\n    mov rdi, 1           ; stdout\r\n    lea rsi, [rsp]       ; buffer\r\n    syscall\r\n    lea rsp, [rsp\u002Br8]    ; deallocate buffer\r\n    lea rsp, [rsp\u002Br8*8]  ; deallocate digit pushes\r\n    ; RUNTIME: stdout_put_nl\r\n    mov rax, 1     ; sys_write\r\n    mov rdi, 1     ; stdout\r\n    lea rsi, [newline]\r\n    mov rdx, 1\r\n    syscall\r\n    pop rcx         ; restore rcx\r\n    mov rdi, rbx    ; exit code\r\n    mov rax, 60     ; sys_exit\r\n    syscall\r\n\r\nsection .data\r\nnewline db 0x0A\r\ni dq 0\r\ntotal dq 0\r\nstr_0 db \u0022Euler #1 = \u0022, 0\r\n"
}
