{
  "schemaVersion": 1,
  "success": true,
  "version": "0.2.1-alpha",
  "source": "D:\\_2025\\Gits\\megaalive\\hlax64\\examples\\interop\\07-interop\\extern-puts.hla64",
  "target": "linux-x64-sysv",
  "diagnostics": [],
  "ir": [
    "function _start:\n  entry:\n    Call v0 [extern:puts]\n    v1 = Move v2"
  ],
  "lowered": [
    "function _start:\n  entry: True, export: False\n  stack frame: 8 bytes\n  externs: puts\n  entry:\n        xor ebx, ebx    ; default exit code = 0 (callee-saved)\n        push rbp\n        mov rbp, rsp\n        sub rsp, 8      ; align stack to 16 bytes\n        lea rdi, [rel str_0]\r\n    sub rsp, 8      ; align stack\r\n    call puts\r\n    add rsp, 8      ; restore stack\n        mov rbx, rax\n        mov rdi, rbx    ; exit code\n        mov rax, 60     ; sys_exit\n        syscall"
  ],
  "nasm": "bits 64\r\ndefault rel\r\nextern puts\r\nsection .text\r\nglobal _start\r\n\r\n_start:\r\n    xor ebx, ebx    ; default exit code = 0 (callee-saved)\r\n    push rbp\r\n    mov rbp, rsp\r\n    sub rsp, 8      ; align stack to 16 bytes\r\n    lea rdi, [rel str_0]\r\n    sub rsp, 8      ; align stack\r\n    call puts\r\n    add rsp, 8      ; restore stack\r\n    mov rbx, rax\r\n    mov rdi, rbx    ; exit code\r\n    mov rax, 60     ; sys_exit\r\n    syscall\r\n\r\nsection .data\r\nnewline db 0x0A\r\nstr_0 db \u0022Hello from puts\u0022, 0\r\n"
}
