{
  "schemaVersion": 1,
  "success": true,
  "version": "0.2.1-alpha",
  "source": "D:\\_2025\\Gits\\megaalive\\hlax64\\examples\\project-euler\\problems\\euler005-smallest-multiple.hla64",
  "target": "linux-x64-sysv",
  "diagnostics": [],
  "ir": [
    "function _start:\n  entry:\n    v18 = Move v19\n    v20 = Move v21\n    Branch  -\u003E while_header_1\n  while_header_1:\n    Compare (LessThanSigned) v20, v22\n    ConditionalBranch (GreaterOrEqualSigned)  -\u003E endwhile_1\n    Branch  -\u003E while_body_1\n  while_body_1:\n    Call v18, v20 [Lcm]\n    v18 = Move v4\n    v20 = Add v23\n    Branch  -\u003E while_header_1\n  endwhile_1:\n    Branch  -\u003E cont_1\n  cont_1:\n    Call v24, v18, v25 [stdout.put]",
    "function Gcd:\n  entry:\n    v4 = Move v5\n    v6 = Move v4\n    v7 = Move v8\n    v9 = Move v7\n    v7 = Move v9\n    Branch  -\u003E while_header_0\n  while_header_0:\n    Compare (GreaterThanSigned) v7, v10\n    ConditionalBranch (LessOrEqualSigned)  -\u003E endwhile_0\n    Branch  -\u003E while_body_0\n  while_body_0:\n    v4 = Move v6\n    v11 = Move v9\n    v4 = Modulo v11\n    v7 = Move v9\n    v6 = Move v7\n    v9 = Move v4\n    v7 = Move v9\n    Branch  -\u003E while_header_0\n  endwhile_0:\n    Branch  -\u003E cont_0\n  cont_0:\n    v4 = Move v6",
    "function Lcm:\n  entry:\n    Call v5, v8 [Gcd]\n    v16 = Move v4\n    v4 = Move v5\n    v11 = Move v16\n    v4 = Divide v11\n    v17 = Move v4\n    v4 = Move v17\n    v4 = Multiply v8"
  ],
  "lowered": [
    "function _start:\n  entry: True, export: False\n  stack frame: 8 bytes\n  entry:\n        xor ebx, ebx    ; default exit code = 0 (callee-saved)\n        push rbp\n        mov rbp, rsp\n        sub rsp, 8      ; align stack to 16 bytes\n        mov r12, 1\n        mov r13, 2\n        jmp while_header_1\n  while_header_1:\n        cmp r13, 21\n        jge endwhile_1\n        jmp while_body_1\n  while_body_1:\n        mov rdi, r12\r\n    mov rsi, r13\r\n    sub rsp, 8      ; align stack\r\n    call Lcm\r\n    add rsp, 8      ; restore stack\n        mov r12, rax\n        add r13, 1\n        jmp while_header_1\n  endwhile_1:\n        jmp cont_1\n  cont_1:\n        push rcx        ; preserve rcx (syscall clobbers it)\r\n    push r12      ; save for stdout.put\r\n    ; RUNTIME: stdout_put_str\r\n    mov rax, 1     ; sys_write\r\n    mov rdi, 1     ; stdout\r\n    lea rsi, [str_0]\r\n    mov rdx, 11\r\n    syscall\r\n    ; RUNTIME: stdout_put_int(r12)\r\n    pop rax         ; get saved register value\r\n    mov r8, 10\r\n    mov rdi, 0          ; digit count\r\n    jmp .Lchk_0\r\n.Ldiv_0:\r\n    xor rdx, rdx\r\n    div r8\r\n    push rdx             ; digit\r\n    inc rdi\r\n.Lchk_0:\r\n    test rax, rax\r\n    jnz .Ldiv_0\r\n    ; rdi = digit count, digits on stack\r\n    test rdi, rdi\r\n    jnz .Lbuf_0\r\n    push 0               ; zero digit\r\n    inc rdi\r\n.Lbuf_0:\r\n    mov rdx, rdi         ; byte count\r\n    sub rsp, rdx         ; stack buffer\r\n    mov r9, rdi          ; loop count\r\n    lea rsi, [rsp]       ; buffer ptr\r\n    lea rdi, [rsp\u002Brdx]   ; ptr to most significant digit\r\n.Lascii_0:\r\n    mov rax, [rdi]       ; read digit\r\n    add al, \u00270\u0027\r\n    mov [rsi], al\r\n    inc rsi\r\n    add rdi, 8           ; next digit\r\n    dec r9\r\n    jnz .Lascii_0\r\n    mov r8, rdx          ; save digit count\r\n    mov rax, 1           ; sys_write\r\n    mov rdi, 1           ; stdout\r\n    lea rsi, [rsp]       ; buffer\r\n    syscall\r\n    lea rsp, [rsp\u002Br8]    ; deallocate buffer\r\n    lea rsp, [rsp\u002Br8*8]  ; deallocate digit pushes\r\n    ; RUNTIME: stdout_put_nl\r\n    mov rax, 1     ; sys_write\r\n    mov rdi, 1     ; stdout\r\n    lea rsi, [newline]\r\n    mov rdx, 1\r\n    syscall\r\n    pop rcx         ; restore rcx\n        mov rdi, rbx    ; exit code\n        mov rax, 60     ; sys_exit\n        syscall",
    "function Gcd:\n  entry: False, export: False\n  stack frame: 32 bytes\n  parameters: a, b\n  entry:\n        push rbp\n        mov rbp, rsp\n        sub rsp, 32\n        mov qword [rbp-8], rdi\n        mov qword [rbp-16], rsi\n        mov rax, qword [rbp-8]\n        mov qword [rbp-24], rax\n        mov r11, qword [rbp-16]\n        mov qword [rbp-32], r11\n        mov r11, qword [rbp-32]\n        jmp while_header_0\n  while_header_0:\n        cmp r11, 0\n        jle endwhile_0\n        jmp while_body_0\n  while_body_0:\n        mov rax, qword [rbp-24]\n        mov r10, qword [rbp-32]\n        cqo\r\n    idiv r10\r\n    mov rax, rdx\n        mov r11, qword [rbp-32]\n        mov qword [rbp-24], r11\n        mov qword [rbp-32], rax\n        mov r11, qword [rbp-32]\n        jmp while_header_0\n  endwhile_0:\n        jmp cont_0\n  cont_0:\n        mov rax, qword [rbp-24]\n        mov rsp, rbp\n        pop rbp\n        ret",
    "function Lcm:\n  entry: False, export: False\n  stack frame: 32 bytes\n  parameters: a, b\n  entry:\n        push rbp\n        mov rbp, rsp\n        sub rsp, 32\n        mov qword [rbp-8], rdi\n        mov qword [rbp-16], rsi\n        mov rdi, [rbp-8]\r\n    mov rsi, [rbp-16]\r\n    sub rsp, 8      ; align stack\r\n    call Gcd\r\n    add rsp, 8      ; restore stack\n        mov qword [rbp-24], rax\n        mov rax, qword [rbp-8]\n        mov r10, qword [rbp-24]\n        cqo\r\n    idiv r10\n        mov qword [rbp-32], rax\n        mov rax, qword [rbp-32]\n        imul rax, qword [rbp-16]\n        mov rsp, rbp\n        pop rbp\n        ret"
  ],
  "nasm": "bits 64\r\nsection .text\r\nglobal _start\r\n\r\n_start:\r\n    xor ebx, ebx    ; default exit code = 0 (callee-saved)\r\n    push rbp\r\n    mov rbp, rsp\r\n    sub rsp, 8      ; align stack to 16 bytes\r\n    mov r12, 1\r\n    mov r13, 2\r\n    jmp while_header_1\r\nwhile_header_1:\r\n    cmp r13, 21\r\n    jge endwhile_1\r\n    jmp while_body_1\r\nwhile_body_1:\r\n    mov rdi, r12\r\n    mov rsi, r13\r\n    sub rsp, 8      ; align stack\r\n    call Lcm\r\n    add rsp, 8      ; restore stack\r\n    mov r12, rax\r\n    add r13, 1\r\n    jmp while_header_1\r\nendwhile_1:\r\n    jmp cont_1\r\ncont_1:\r\n    push rcx        ; preserve rcx (syscall clobbers it)\r\n    push r12      ; save for stdout.put\r\n    ; RUNTIME: stdout_put_str\r\n    mov rax, 1     ; sys_write\r\n    mov rdi, 1     ; stdout\r\n    lea rsi, [str_0]\r\n    mov rdx, 11\r\n    syscall\r\n    ; RUNTIME: stdout_put_int(r12)\r\n    pop rax         ; get saved register value\r\n    mov r8, 10\r\n    mov rdi, 0          ; digit count\r\n    jmp .Lchk_0\r\n    .Ldiv_0:\r\n    xor rdx, rdx\r\n    div r8\r\n    push rdx             ; digit\r\n    inc rdi\r\n    .Lchk_0:\r\n    test rax, rax\r\n    jnz .Ldiv_0\r\n    ; rdi = digit count, digits on stack\r\n    test rdi, rdi\r\n    jnz .Lbuf_0\r\n    push 0               ; zero digit\r\n    inc rdi\r\n    .Lbuf_0:\r\n    mov rdx, rdi         ; byte count\r\n    sub rsp, rdx         ; stack buffer\r\n    mov r9, rdi          ; loop count\r\n    lea rsi, [rsp]       ; buffer ptr\r\n    lea rdi, [rsp\u002Brdx]   ; ptr to most significant digit\r\n    .Lascii_0:\r\n    mov rax, [rdi]       ; read digit\r\n    add al, \u00270\u0027\r\n    mov [rsi], al\r\n    inc rsi\r\n    add rdi, 8           ; next digit\r\n    dec r9\r\n    jnz .Lascii_0\r\n    mov r8, rdx          ; save digit count\r\n    mov rax, 1           ; sys_write\r\n    mov rdi, 1           ; stdout\r\n    lea rsi, [rsp]       ; buffer\r\n    syscall\r\n    lea rsp, [rsp\u002Br8]    ; deallocate buffer\r\n    lea rsp, [rsp\u002Br8*8]  ; deallocate digit pushes\r\n    ; RUNTIME: stdout_put_nl\r\n    mov rax, 1     ; sys_write\r\n    mov rdi, 1     ; stdout\r\n    lea rsi, [newline]\r\n    mov rdx, 1\r\n    syscall\r\n    pop rcx         ; restore rcx\r\n    mov rdi, rbx    ; exit code\r\n    mov rax, 60     ; sys_exit\r\n    syscall\r\n\r\nGcd:\r\n    push rbp\r\n    mov rbp, rsp\r\n    sub rsp, 32\r\n    mov qword [rbp-8], rdi\r\n    mov qword [rbp-16], rsi\r\n    mov rax, qword [rbp-8]\r\n    mov qword [rbp-24], rax\r\n    mov r11, qword [rbp-16]\r\n    mov qword [rbp-32], r11\r\n    mov r11, qword [rbp-32]\r\n    jmp while_header_0\r\nwhile_header_0:\r\n    cmp r11, 0\r\n    jle endwhile_0\r\n    jmp while_body_0\r\nwhile_body_0:\r\n    mov rax, qword [rbp-24]\r\n    mov r10, qword [rbp-32]\r\n    cqo\r\n    idiv r10\r\n    mov rax, rdx\r\n    mov r11, qword [rbp-32]\r\n    mov qword [rbp-24], r11\r\n    mov qword [rbp-32], rax\r\n    mov r11, qword [rbp-32]\r\n    jmp while_header_0\r\nendwhile_0:\r\n    jmp cont_0\r\ncont_0:\r\n    mov rax, qword [rbp-24]\r\n    mov rsp, rbp\r\n    pop rbp\r\n    ret\r\n\r\nLcm:\r\n    push rbp\r\n    mov rbp, rsp\r\n    sub rsp, 32\r\n    mov qword [rbp-8], rdi\r\n    mov qword [rbp-16], rsi\r\n    mov rdi, [rbp-8]\r\n    mov rsi, [rbp-16]\r\n    sub rsp, 8      ; align stack\r\n    call Gcd\r\n    add rsp, 8      ; restore stack\r\n    mov qword [rbp-24], rax\r\n    mov rax, qword [rbp-8]\r\n    mov r10, qword [rbp-24]\r\n    cqo\r\n    idiv r10\r\n    mov qword [rbp-32], rax\r\n    mov rax, qword [rbp-32]\r\n    imul rax, qword [rbp-16]\r\n    mov rsp, rbp\r\n    pop rbp\r\n    ret\r\n\r\nsection .data\r\nnewline db 0x0A\r\nstr_0 db \u0022Euler #5 = \u0022, 0\r\n"
}
