{
  "schemaVersion": 1,
  "success": true,
  "version": "0.2.1-alpha",
  "source": "D:\\_2025\\Gits\\megaalive\\hlax64\\examples\\tools\\12-linux\\exists\\exists.hla64",
  "target": "linux-x64-sysv",
  "diagnostics": [],
  "ir": [
    "function _start:\n  entry:\n    Call  [extern:hlax_argv_init]\n    Call  [extern:hlax_argv_count]\n    Compare (LessThanSigned) v0, v1\n    ConditionalBranch (LessThanSigned)  -\u003E then_0\n    Branch  -\u003E else_0\n  then_0:\n    Call v2, v3 [stdout.put]\n    v4 = Move v5\n    Branch  -\u003E endif_0\n  else_0:\n    Call v6 [extern:hlax_argv_get]\n    v7 = Move v0\n    Call v7 [extern:hlax_path_exists]\n    Compare (Equal) v0, v8\n    ConditionalBranch (Equal)  -\u003E then_1\n    Branch  -\u003E else_1\n  then_1:\n    Call v9, v3 [stdout.put]\n    v4 = Move v10\n    Branch  -\u003E endif_1\n  else_1:\n    Call v11, v3 [stdout.put]\n    v4 = Move v12\n    Branch  -\u003E endif_1\n  endif_1:\n    Branch  -\u003E cont_1\n  cont_1:\n    Branch  -\u003E endif_0\n  endif_0:\n    Branch  -\u003E cont_0\n  cont_0:"
  ],
  "lowered": [
    "function _start:\n  entry: True, export: False\n  stack frame: 8 bytes\n  externs: hlax_argv_save_from_stack, hlax_argv_init, hlax_argv_count, hlax_argv_get, hlax_path_exists\n  entry:\n        mov rdi, rsp    ; kernel argc/argv block\n        call hlax_argv_save_from_stack\n        xor ebx, ebx    ; default exit code = 0 (callee-saved)\n        push rbp\n        mov rbp, rsp\n        sub rsp, 8      ; align stack to 16 bytes\n        sub rsp, 8      ; align stack\r\n    call hlax_argv_init\r\n    add rsp, 8      ; restore stack\n        sub rsp, 8      ; align stack\r\n    call hlax_argv_count\r\n    add rsp, 8      ; restore stack\n        cmp rax, 2\n        jl then_0\n        jmp else_0\n  then_0:\n        push rcx        ; preserve rcx (syscall clobbers it)\r\n    ; RUNTIME: stdout_put_str\r\n    mov rax, 1     ; sys_write\r\n    mov rdi, 1     ; stdout\r\n    lea rsi, [str_0]\r\n    mov rdx, 20\r\n    syscall\r\n    ; RUNTIME: stdout_put_nl\r\n    mov rax, 1     ; sys_write\r\n    mov rdi, 1     ; stdout\r\n    lea rsi, [newline]\r\n    mov rdx, 1\r\n    syscall\r\n    pop rcx         ; restore rcx\n        mov rbx, 1\n        jmp endif_0\n  else_0:\n        mov rdi, 1\r\n    sub rsp, 8      ; align stack\r\n    call hlax_argv_get\r\n    add rsp, 8      ; restore stack\n        mov r12, rax\n        mov rdi, r12\r\n    sub rsp, 8      ; align stack\r\n    call hlax_path_exists\r\n    add rsp, 8      ; restore stack\n        cmp rax, 0\n        je then_1\n        jmp else_1\n  then_1:\n        push rcx        ; preserve rcx (syscall clobbers it)\r\n    ; RUNTIME: stdout_put_str\r\n    mov rax, 1     ; sys_write\r\n    mov rdi, 1     ; stdout\r\n    lea rsi, [str_1]\r\n    mov rdx, 7\r\n    syscall\r\n    ; RUNTIME: stdout_put_nl\r\n    mov rax, 1     ; sys_write\r\n    mov rdi, 1     ; stdout\r\n    lea rsi, [newline]\r\n    mov rdx, 1\r\n    syscall\r\n    pop rcx         ; restore rcx\n        mov rbx, 1\n        jmp endif_1\n  else_1:\n        push rcx        ; preserve rcx (syscall clobbers it)\r\n    ; RUNTIME: stdout_put_str\r\n    mov rax, 1     ; sys_write\r\n    mov rdi, 1     ; stdout\r\n    lea rsi, [str_2]\r\n    mov rdx, 6\r\n    syscall\r\n    ; RUNTIME: stdout_put_nl\r\n    mov rax, 1     ; sys_write\r\n    mov rdi, 1     ; stdout\r\n    lea rsi, [newline]\r\n    mov rdx, 1\r\n    syscall\r\n    pop rcx         ; restore rcx\n        mov rbx, 0\n        jmp endif_1\n  endif_1:\n        jmp cont_1\n  cont_1:\n        jmp endif_0\n  endif_0:\n        jmp cont_0\n  cont_0:\n        mov rdi, rbx    ; exit code\n        mov rax, 60     ; sys_exit\n        syscall"
  ],
  "nasm": "bits 64\r\ndefault rel\r\nextern hlax_argv_save_from_stack\r\nextern hlax_argv_init\r\nextern hlax_argv_count\r\nextern hlax_argv_get\r\nextern hlax_path_exists\r\nsection .text\r\nglobal _start\r\n\r\n_start:\r\n    mov rdi, rsp    ; kernel argc/argv block\r\n    call hlax_argv_save_from_stack\r\n    xor ebx, ebx    ; default exit code = 0 (callee-saved)\r\n    push rbp\r\n    mov rbp, rsp\r\n    sub rsp, 8      ; align stack to 16 bytes\r\n    sub rsp, 8      ; align stack\r\n    call hlax_argv_init\r\n    add rsp, 8      ; restore stack\r\n    sub rsp, 8      ; align stack\r\n    call hlax_argv_count\r\n    add rsp, 8      ; restore stack\r\n    cmp rax, 2\r\n    jl then_0\r\n    jmp else_0\r\nthen_0:\r\n    push rcx        ; preserve rcx (syscall clobbers it)\r\n    ; RUNTIME: stdout_put_str\r\n    mov rax, 1     ; sys_write\r\n    mov rdi, 1     ; stdout\r\n    lea rsi, [str_0]\r\n    mov rdx, 20\r\n    syscall\r\n    ; RUNTIME: stdout_put_nl\r\n    mov rax, 1     ; sys_write\r\n    mov rdi, 1     ; stdout\r\n    lea rsi, [newline]\r\n    mov rdx, 1\r\n    syscall\r\n    pop rcx         ; restore rcx\r\n    mov rbx, 1\r\n    jmp endif_0\r\nelse_0:\r\n    mov rdi, 1\r\n    sub rsp, 8      ; align stack\r\n    call hlax_argv_get\r\n    add rsp, 8      ; restore stack\r\n    mov r12, rax\r\n    mov rdi, r12\r\n    sub rsp, 8      ; align stack\r\n    call hlax_path_exists\r\n    add rsp, 8      ; restore stack\r\n    cmp rax, 0\r\n    je then_1\r\n    jmp else_1\r\nthen_1:\r\n    push rcx        ; preserve rcx (syscall clobbers it)\r\n    ; RUNTIME: stdout_put_str\r\n    mov rax, 1     ; sys_write\r\n    mov rdi, 1     ; stdout\r\n    lea rsi, [str_1]\r\n    mov rdx, 7\r\n    syscall\r\n    ; RUNTIME: stdout_put_nl\r\n    mov rax, 1     ; sys_write\r\n    mov rdi, 1     ; stdout\r\n    lea rsi, [newline]\r\n    mov rdx, 1\r\n    syscall\r\n    pop rcx         ; restore rcx\r\n    mov rbx, 1\r\n    jmp endif_1\r\nelse_1:\r\n    push rcx        ; preserve rcx (syscall clobbers it)\r\n    ; RUNTIME: stdout_put_str\r\n    mov rax, 1     ; sys_write\r\n    mov rdi, 1     ; stdout\r\n    lea rsi, [str_2]\r\n    mov rdx, 6\r\n    syscall\r\n    ; RUNTIME: stdout_put_nl\r\n    mov rax, 1     ; sys_write\r\n    mov rdi, 1     ; stdout\r\n    lea rsi, [newline]\r\n    mov rdx, 1\r\n    syscall\r\n    pop rcx         ; restore rcx\r\n    mov rbx, 0\r\n    jmp endif_1\r\nendif_1:\r\n    jmp cont_1\r\ncont_1:\r\n    jmp endif_0\r\nendif_0:\r\n    jmp cont_0\r\ncont_0:\r\n    mov rdi, rbx    ; exit code\r\n    mov rax, 60     ; sys_exit\r\n    syscall\r\n\r\nsection .data\r\nnewline db 0x0A\r\nstr_0 db \u0022usage: exists \u003Cpath\u003E\u0022, 0\r\nstr_1 db \u0022missing\u0022, 0\r\nstr_2 db \u0022exists\u0022, 0\r\n"
}
