{
  "schemaVersion": 1,
  "success": true,
  "version": "0.2.1-alpha",
  "source": "D:\\_2025\\Gits\\megaalive\\hlax64\\examples\\qa\\bug-farm\\idiv-loop\\idiv-loop.hla64",
  "target": "linux-x64-sysv",
  "diagnostics": [],
  "ir": [
    "function _start:\n  entry:\n    v0 = Move v1\n    v2 = Move v3\n    v4 = Move v5\n    Branch  -\u003E while_header_0\n  while_header_0:\n    Compare (LessThanSigned) v0, v4\n    ConditionalBranch (GreaterOrEqualSigned)  -\u003E endwhile_0\n    Branch  -\u003E while_body_0\n  while_body_0:\n    v6 = Move v7\n    v8 = Move v9\n    v6 = Divide v8\n    v2 = Add v6\n    v0 = Add v10\n    Branch  -\u003E while_header_0\n  endwhile_0:\n    Branch  -\u003E cont_0\n  cont_0:"
  ],
  "lowered": [
    "function _start:\n  entry: True, export: False\n  stack frame: 8 bytes\n  entry:\n        xor ebx, ebx    ; default exit code = 0 (callee-saved)\n        push rbp\n        mov rbp, rsp\n        sub rsp, 8      ; align stack to 16 bytes\n        mov r10, 0\n        mov rbx, 0\n        mov r9, 10\n        jmp while_header_0\n  while_header_0:\n        cmp r10, r9\n        jge endwhile_0\n        jmp while_body_0\n  while_body_0:\n        mov rax, 32319\n        mov r11, 5040\n        cqo\r\n    idiv r11\n        add rbx, rax\n        add r10, 1\n        jmp while_header_0\n  endwhile_0:\n        jmp cont_0\n  cont_0:\n        mov rdi, rbx    ; exit code\n        mov rax, 60     ; sys_exit\n        syscall"
  ],
  "nasm": "bits 64\r\nsection .text\r\nglobal _start\r\n\r\n_start:\r\n    xor ebx, ebx    ; default exit code = 0 (callee-saved)\r\n    push rbp\r\n    mov rbp, rsp\r\n    sub rsp, 8      ; align stack to 16 bytes\r\n    mov r10, 0\r\n    mov rbx, 0\r\n    mov r9, 10\r\n    jmp while_header_0\r\nwhile_header_0:\r\n    cmp r10, r9\r\n    jge endwhile_0\r\n    jmp while_body_0\r\nwhile_body_0:\r\n    mov rax, 32319\r\n    mov r11, 5040\r\n    cqo\r\n    idiv r11\r\n    add rbx, rax\r\n    add r10, 1\r\n    jmp while_header_0\r\nendwhile_0:\r\n    jmp cont_0\r\ncont_0:\r\n    mov rdi, rbx    ; exit code\r\n    mov rax, 60     ; sys_exit\r\n    syscall\r\n\r\nsection .data\r\nnewline db 0x0A\r\n"
}
